{
  "version": "1.0.6",
  "description": "Eigent desktop app for workflow reliability, connector setup, and agent work-logs.",
  "homepage": "https://github.com/eigent-ai/eigent",
  "license": "Apache-2.0",
  "architecture": {
    "64bit": {
      "url": "https://github.com/eigent-ai/eigent/releases/download/v1.0.6/Eigent.Setup.1.0.6.exe#/dl.7z",
      "hash": "bf8e70192445557054b5279bacd1f2a50db330c85b40482e65b897f79dadfdc0"
    }
  },
  "installer": {
    "script": [
      "if (!(Test-Path \"$dir\\config\")) { New-Item -ItemType Directory -Path \"$dir\\config\" | Out-Null }",
      "Expand-7zipArchive \"$dir\\$fname\" \"$dir\"",
      "Remove-Item \"$dir\\$fname\"",
      "Remove-Item \"$dir\\`$*\" -Recurse -Force -ErrorAction SilentlyContinue"
    ]
  },
  "bin": "eigent.exe",
  "persist": "config",
  "shortcuts": [
    [
      "eigent.exe",
      "Eigent"
    ]
  ],
  "checkver": {
    "github": "https://github.com/eigent-ai/eigent"
  },
  "autoupdate": {
    "architecture": {
      "64bit": {
        "url": "https://github.com/eigent-ai/eigent/releases/download/v$version/Eigent.Setup.$version.exe#/dl.7z"
      }
    }
  }
}
