{
  "version": "2.580.2",
  "description": "(Long Term Support) An automation server which enables developers around the world to reliably build, test, and deploy their software",
  "homepage": "https://www.jenkins.io/",
  "license": "MIT",
  "suggest": {
    "JDK 11": [
      "java/openjdk11",
      "java/temurin11-jdk",
      "java/zulu11-jdk"
    ]
  },
  "url": "https://get.jenkins.io/war-stable/2.580.2/jenkins.war#/jenkins.jar",
  "hash": "d98032d2401c540a35613a82ed358921fcf3166d5e6eaaaf60a7941845be3251",
  "bin": "jenkins.jar",
  "checkver": {
    "url": "https://www.jenkins.io/changelog-stable/rss.xml",
    "xpath": "/rss/channel/item/title",
    "regex": "Jenkins ([\\d.]+)"
  },
  "autoupdate": {
    "url": "https://get.jenkins.io/war-stable/$version/jenkins.war#/jenkins.jar",
    "hash": {
      "url": "$url.sha256"
    }
  }
}
