{
    "version": "0.88.0",
    "homepage": "https://github.com/VHDL-LS/rust_hdl",
    "description": "A fast VHDL language server and analysis library written in Rust.",
    "license": "MPL-2.0",
    "architecture": {
        "64bit": {
            "url": "https://github.com/VHDL-LS/rust_hdl/releases/download/v0.88.0/vhdl_ls-x86_64-pc-windows-msvc.zip",
            "hash": "999f644aeb86bba19ab1b4bcda7460925186a3a5ca287d2f2f865cb4c1f4579d",
            "extract_dir": "vhdl_ls-x86_64-pc-windows-msvc"
        }
    },
    "bin": "bin\\vhdl_ls.exe",
    "checkver": "github",
    "autoupdate": {
        "architecture": {
            "64bit": {
                "url": "https://github.com/VHDL-LS/rust_hdl/releases/download/v$version/vhdl_ls-x86_64-pc-windows-msvc.zip"
            }
        }
    }
}
