{
    "version": "1.2.1",
    "description": "scoop命令",
    "homepage": "https://github.com/nyable/nyaru",
    "checkver": "github",
    "license": "MIT",
    "architecture": {
        "64bit": {
            "url": "https://github.com/nyable/nyaru/releases/download/v1.2.1/nyaru.exe",
            "hash": "0892fad9b93066ed61f19d59c1530a2060c1168c244f73e96434c31a319180b9"
        }
    },
    "bin": "nyaru.exe",
    "autoupdate": {
        "architecture": {
            "64bit": {
                "url": "https://github.com/nyable/nyaru/releases/download/v$version/nyaru.exe",
                "hash": {
                    "url": "https://github.com/nyable/nyaru/releases/tag/v$version",
                    "regex": "(?m)^\\s*([a-fA-F0-9]{64})\\s+nyaru\\.exe$"
                }
            }
        }
    }
}
