{
    "version": "1.5.0",
    "description": "ðŸ¥§ The Cross-Platform Pie Menu.",
    "homepage": "https://ko-fi.com/post/Kando-1-0-0-released-G2G5Z1DOS",
    "license": {
        "identifier": "MIT license",
        "url": "https://github.com/kando-menu/kando?tab=readme-ov-file#License-1-ov-file"
    },
    "url": "https://github.com/kando-menu/kando/releases/download/v1.5.0/Kando-1.5.0.Setup.exe#/dl.7z",
    "hash": "74670b25331b284aea780610e3d72af26dd6e1793b62132b0749c153a81de145",
    "pre_install": [
        "Get-Item \"$dir\\kando*.nupkg\" | Rename-Item -NewName 'kando.nupkg'",
        "Expand-7zipArchive \"$dir\\kando.nupkg\" \"$dir\" -ExtractDir 'lib\\net45'",
        "Remove-Item \"$dir\\background.gif\", \"$dir\\*.nupkg\", \"$dir\\RELEASES\", \"$dir\\Update.exe\" -Force -Recurse"
    ],
    "installer": {
        "script": [
            "# handle runtime cache",
            "Import-Module $(Join-Path $(Find-BucketDirectory -Root -Name apps) scripts/AppsUtils.psm1)",
            "Mount-ExternalRuntimeData -Source \"$persist_dir\" -Target \"$env:APPDATA\\kando\"",
            "Remove-Module -Name AppsUtils"
        ]
    },
    "uninstaller": {
        "script": [
            "Import-Module $(Join-Path $(Find-BucketDirectory -Root -Name apps) scripts/AppsUtils.psm1)",
            "Dismount-ExternalRuntimeData -Target \"$env:APPDATA\\kando\"",
            "Remove-Module -Name AppsUtils"
        ]
    },
    "bin": "kando.exe",
    "shortcuts": [
        [
            "kando.exe",
            "Kando"
        ]
    ],
    "checkver": {
        "url": "https://api.github.com/repos/kando-menu/kando/releases",
        "regex": "/releases/tag/v([\\d.]+)"
    },
    "autoupdate": {
        "url": "https://github.com/kando-menu/kando/releases/download/v$version/Kando-$version.Setup.exe#/dl.7z"
    }
}
