{
    "version": "1.11.0",
    "description": "A download manager that speeds up your downloads",
    "homepage": "https://abdownloadmanager.com",
    "license": "Apache-2.0",
    "architecture": {
        "64bit": {
            "url": "https://github.com/amir1376/ab-download-manager/releases/download/v1.11.0/ABDownloadManager_1.11.0_windows_x64.zip",
            "hash": "7e95d2ea136bd7baef0bb0e1f06bdaac9a26f6ce7dbf3669d090c9f90b1b0919"
        }
    },
    "extract_dir": "ABDownloadManager",
    "post_install": [
        "if (!(Test-Path \"$persist_dir\\.abdm\") -and (Test-Path \"$env:USERPROFILE\\.abdm\")) {",
        "    info \"Moving configs to persist directory...\"",
        "    Copy-Item -Path \"$env:USERPROFILE\\.abdm\\*\" -Destination \"$persist_dir\\.abdm\" -Force -Recurse | Out-Null",
        "}"
    ],
    "shortcuts": [
        [
            "ABDownloadManager.exe",
            "ABDownloadManager"
        ]
    ],
    "persist": ".abdm",
    "checkver": {
        "github": "https://github.com/amir1376/ab-download-manager"
    },
    "autoupdate": {
        "architecture": {
            "64bit": {
                "url": "https://github.com/amir1376/ab-download-manager/releases/download/v$version/ABDownloadManager_$version_windows_x64.zip"
            }
        }
    }
}
