{
  "version": "0.1",
  "description": "Burp Suite Text4Shell 漏洞扫描器插件",
  "homepage": "https://github.com/silentsignal/burp-text4shell",
  "license": "GPL-3.0",
  "url": "https://github.com/silentsignal/burp-text4shell/releases/download/v0.1/burp-text4shell.jar",
  "hash": "sha256:186D22F40B528A63161E9EB97D69D8D41463427875F51368A095A212702A3BFB",
  "checkver": "github",
  "autoupdate": {
    "url": "https://github.com/silentsignal/burp-text4shell/releases/download/v$version/burp-text4shell.jar"
  },
  "notes": [
    "【工具类型】: Burp Suite扩展",
    "【主要功能】: Burp Suite Text4Shell 漏洞扫描器插件",
    "【适用场景】: 根据描述推断的适用场景",
    "【技术特点】: 基于Java开发，需配合Burp Suite使用"
  ]
}
