{
    "version": "3.29",
    "description": "MEGAcmd's best friend",
    "homepage": "https://github.com/tonikelope/megadoctor",
    "license": "GPL-3.0-only",
    "depends": "megacmd",
    "suggest": {
        "JDK": [
            "java/openjdk",
            "java/oraclejdk"
        ]
    },
    "url": [
        "https://github.com/tonikelope/megadoctor/releases/download/v3.29/MegaDoctor-3.29.jar#/MegaDoctor.jar",
        "https://raw.githubusercontent.com/szyha/bucket/refs/heads/resources/megadoctor.ico#/MegaDoctor.ico"
    ],
    "hash": [
        "519da5473cdfbcc85ea91c4e8f5b55577fc07e07b789f642df76ceaa64225275",
        "0c099d710cfe37583fbbdffbce6afd818dfe2d45fd6585acd57e7dfdc94131b7"
    ],
    "pre_install": "Set-Content \"$dir\\MegaDoctor.bat\" '@start javaw.exe -jar \"%~dp0MegaDoctor.jar\" %*' -Encoding Ascii",
    "shortcuts": [
        [
            "MegaDoctor.bat",
            "MegaDoctor",
            "",
            "MegaDoctor.ico"
        ]
    ],
    "checkver": "github",
    "autoupdate": {
        "url": "https://github.com/tonikelope/megadoctor/releases/download/v$version/MegaDoctor-$version.jar#/MegaDoctor.jar"
    }
}
