{
    "version": "2.5.11",
    "description": "Plays internet radio streams and manages your favorite stations.",
    "homepage": "https://www.netradio.info/app/",
    "license": "Freeware",
    "suggest": {
        ".NET Desktop Runtime 8.0": "versions/windowsdesktop-runtime-8.0"
    },
    "architecture": {
        "64bit": {
            "url": "https://www.netradio.info/?sdm_process_download=1&download_id=212#/NetRadioSetup.exe",
            "hash": "e9ed83966aa95c601d488752cfbe6576ffe4e3b870c3e46cc59c282e4ecce53e"
        }
    },
    "innosetup": true,
    "pre_install": [
        "if (!(Test-Path \"$persist_dir\\NetRadio.xml\")) {",
        "    Add-Content \"$dir\\NetRadio.xml\" '<NetRadio></NetRadio>' -Encoding Ascii",
        "}"
    ],
    "shortcuts": [
        [
            "NetRadio.exe",
            "NetRadio"
        ]
    ],
    "persist": "NetRadio.xml",
    "checkver": {
        "regex": "sdm_download_version_value\">\\s*(?<version>[\\d.]+).*?download_id=(?<id>\\d+)"
    },
    "autoupdate": {
        "architecture": {
            "64bit": {
                "url": "https://www.netradio.info/?sdm_process_download=1&download_id=$matchId#/NetRadioSetup.exe",
                "hash": {
                    "url": "https://www.netradio.info/app/",
                    "regex": "SHA-256:\\s*$sha256"
                }
            }
        }
    }
}
