{
    "version": "2.0",
    "description": "Portable edition of Vovsoft Vov Stop Start.",
    "homepage": "https://vovsoft.com/software/vov-stop-start/",
    "license": "Proprietary",
    "url": "https://vovsoft.com/files/vov-stop-start-portable.zip?v=2.0",
    "checkver": {
        "url": "https://vovsoft.com/download/vov-stop-start-portable/",
        "regex": "(?is)Version\\s*(?:<[^>]*>\\s*)*:?\\s*(?:<[^>]*>\\s*)*(?<version>\\d+(?:\\.\\d+)+)"
    },
    "autoupdate": {
        "url": "https://vovsoft.com/files/vov-stop-start-portable.zip?v=$version"
    },
    "notes": [
        "SHA-256 and archive contents are not yet verified; inspect the ZIP and confirm the executable path before considering this manifest production-ready."
    ],
    "pre_install": [
        "if (-not (Test-Path -LiteralPath \"$dir\\key.txt\" -PathType Leaf)) { New-Item -ItemType File -Path \"$dir\\key.txt\" | Out-Null }"
    ],
    "persist": "key.txt"
}
