{
    "_comment": "checkver to be: ListDosDevices\\s+V([\\d.]+)",
    "version": "0.2.1",
    "description": "List DOS devices",
    "homepage": "http://www.uwe-sieber.de/drivetools_e.html",
    "license": "Freeware",
    "url": "http://www.uwe-sieber.de/files/listdosdevices.zip",
    "hash": "751055e9f84436afef2cf0547c04b65a136c8ebaabe0f1f3f973a63d21c263dd",
    "bin": "ListDosDevices.exe",
    "autoupdate": {
        "url": "http://www.uwe-sieber.de/files/listdosdevices.zip"
    }
}

