{
    "version": "1.3.6",
    "description": "Cross-platform GUI for Steam Cloud. Visualizes remote storage as a file tree with download, upload, and delete capabilities.",
    "homepage": "https://github.com/Fldicoahkiin/SteamCloudFileManager",
    "license": "GPL-3.0",
    "architecture": {
        "64bit": {
            "url": "https://github.com/Fldicoahkiin/SteamCloudFileManager/releases/download/v1.3.6/SteamCloudFileManager-1.3.6-windows-x86_64.zip",
            "hash": "567ff1402cd001a19b21eb23fd9c5a879d7aeac2431817f480611c1062317626"
        }
    },
    "bin": "SteamCloudFileManager.exe",
    "shortcuts": [
        [
            "SteamCloudFileManager.exe",
            "SteamCloudFileManager"
        ]
    ],
    "checkver": {
        "github": "https://github.com/Fldicoahkiin/SteamCloudFileManager"
    },
    "autoupdate": {
        "architecture": {
            "64bit": {
                "url": "https://github.com/Fldicoahkiin/SteamCloudFileManager/releases/download/v$version/SteamCloudFileManager-$version-windows-x86_64.zip"
            }
        }
    }
}
