{
    "homepage": "https://dexpot.de/",
    "version": "1.6.14.2439",
    "license": "free for private use",
    "url": "https://dexpot.de/download/dexpot_1614_portable_r2439.zip",
    "hash": "f3f0603d1fdf6719f00cfa0e3aca17a657f98b2b5649b73b6c4c66ceaac98b49",
    "bin": "Dexpot.exe",
    "shortcuts": [
        [
            "Dexpot.exe",
            "Dexpot"
        ]
    ],
    "checkver": {
        "url": "https://dexpot.de/?id=changelog",
        "regex": "Dexpot ([\\d.]+) Build (\\d+)",
        "replace": "${1}.${2}"
    },
    "autoupdate": {
        "url": "https://dexpot.de/download/dexpot_$majorVersion$minorVersion$patchVersion_portable_r$buildVersion.zip"
    }
}

