{
  "version": "8.4.27",
  "description": "PHP, a popular general-purpose scripting language that is especially suited to web development. (version 8.4)",
  "homepage": "https://www.php.net",
  "license": "PHP-3.01",
  "suggest": {
    "vcredist": "extras/vcredist2022"
  },
  "architecture": {
    "64bit": {
      "url": "https://downloads.php.net/~windows/releases/archives/php-8.4.27-Win32-vs17-x64.zip",
      "hash": "7902fe891ff4b035d431fd429a2ec1df193ba1f6fedba425d861790465c64e6b"
    },
    "32bit": {
      "url": "https://downloads.php.net/~windows/releases/archives/php-8.4.27-Win32-vs17-x86.zip",
      "hash": "b1f02421a1f92e65930cdf6d5819138cd4ceb120740ef05968387fe72a3c6bda"
    }
  },
  "pre_install": [
    "# Create directory for custom PHP configuration",
    "if (!(Test-Path \"$dir\\cli\\conf.d\")) {",
    "    (New-Item -Type directory \"$dir\\cli\\conf.d\") | Out-Null",
    "}"
  ],
  "post_install": [
    "# Enable extensions to be found in installation-relative folder (the default is to search C:/php)",
    "(Get-Content \"$dir\\cli\\php.ini\") | % { $_ -replace ';\\s?(extension_dir = \"ext\")', '$1' } | Set-Content \"$dir\\cli\\php.ini\""
  ],
  "bin": [
    "php.exe",
    "php-cgi.exe",
    "phpdbg.exe"
  ],
  "env_set": {
    "PHP_INI_SCAN_DIR": "$dir\\cli;$dir\\cli\\conf.d;"
  },
  "persist": [
    "cli",
    [
      "php.ini-production",
      "cli\\php.ini"
    ]
  ],
  "checkver": {
    "url": "https://www.php.net/releases/branches.php",
    "jsonpath": "$.[?(@.branch == '8.4')].latest"
  },
  "autoupdate": {
    "architecture": {
      "64bit": {
        "url": "https://downloads.php.net/~windows/releases/archives/php-$version-Win32-vs17-x64.zip"
      },
      "32bit": {
        "url": "https://downloads.php.net/~windows/releases/archives/php-$version-Win32-vs17-x86.zip"
      }
    },
    "hash": {
      "url": "https://downloads.php.net/~windows/releases/sha256sum.txt"
    }
  }
}
