{
    "version": "1.9",
    "description": "Firewall App Blocker (Fab) 易于使用的Windows防火墙工具 ",
    "homepage": "https://www.sordum.org/downloads/?firewall-app-blocker",
    "license": "Freeware",
    "url": "https://www.sordum.org/files/download/firewall-app-blocker/fab.zip",
    "hash": "a3ba4fd717e892eea3ca627ffe84056eb392f3541aa85e43a57b83436e752803",
    "extract_dir": "fab",
    "architecture": {
        "32bit": {
            "shortcuts": [
                [
                    "Fab.exe",
                    "Firewall App Blocker"
                ]
            ]
        },
        "64bit": {
            "shortcuts": [
                [
                    "Fab_x64.exe",
                    "Firewall App Blocker"
                ]
            ]
        }
    },
    "persist": "Fab.ini",
    "checkver": {
        "url": "https://www.sordum.org/downloads/?firewall-app-blocker",
        "regex": "<title>Download Firewall App Blocker v([\\d.]+)</title>"
    },
    "autoupdate": {
        "url": "https://www.sordum.org/files/download/firewall-app-blocker/fab.zip"
    }
}
