{
  "homepage": "https://github.com/mstorsjo/llvm-mingw",
  "description": "An LLVM/Clang/LLD based mingw-w64 GNU toolchain",
  "version": "22.1.6-20260519",
  "license": "ISC",
  "architecture": {
    "64bit": {
      "url": "https://github.com/mstorsjo/llvm-mingw/releases/download/20260519/llvm-mingw-20260519-ucrt-x86_64.zip",
      "hash": "72dbd6e64614e3b3401998992d1bd9c8ace29e74611d71c80309ea71c3fb26f9",
      "extract_dir": "llvm-mingw-20260519-ucrt-x86_64"
    },
    "32bit": {
      "url": "https://github.com/mstorsjo/llvm-mingw/releases/download/20260519/llvm-mingw-20260519-ucrt-i686.zip",
      "hash": "19a019665bda2107ba298a94dab2749523d3a40bd8f304ad6a0c18d55b4875db",
      "extract_dir": "llvm-mingw-20260519-ucrt-i686"
    },
    "arm64": {
      "url": "https://github.com/mstorsjo/llvm-mingw/releases/download/20260519/llvm-mingw-20260519-ucrt-aarch64.zip",
      "hash": "7bb5e3c9964dc29555cababb55e69eea02a51e98e1240eb9513e6540c7bae0ea",
      "extract_dir": "llvm-mingw-20260519-ucrt-aarch64"
    }
  },
  "env_add_path": "bin",
  "checkver": {
    "regex": "llvm-mingw\\s+(?<date>\\d+)\\swith\\s+LLVM\\s+(?<llvmversion>[\\d.]+)",
    "replace": "${llvmversion}-${date}"
  },
  "autoupdate": {
    "architecture": {
      "64bit": {
        "url": "https://github.com/mstorsjo/llvm-mingw/releases/download/$matchDate/llvm-mingw-$matchDate-ucrt-x86_64.zip",
        "extract_dir": "llvm-mingw-$matchDate-ucrt-x86_64"
      },
      "32bit": {
        "url": "https://github.com/mstorsjo/llvm-mingw/releases/download/$matchDate/llvm-mingw-$matchDate-ucrt-i686.zip",
        "extract_dir": "llvm-mingw-$matchDate-ucrt-i686"
      },
      "arm64": {
        "url": "https://github.com/mstorsjo/llvm-mingw/releases/download/$matchDate/llvm-mingw-$matchDate-ucrt-aarch64.zip",
        "extract_dir": "llvm-mingw-$matchDate-ucrt-aarch64"
      }
    }
  }
}
