{
    "version": "1.3.0",
    "description": "A warmup program that facilitates restoring archived objects from Amazon S3 Glacier storage classes:",
    "homepage": "https://gitlab.com/philipmw/warmup-s3-archives",
    "license": "ISC",
    "architecture": {
        "64bit": {
            "url": "https://gitlab.com/philipmw/warmup-s3-archives/-/releases/v1.3.0/downloads/warmup-s3-archives-v1.3.0-windows-x86_64.exe#/warmup-s3-archives.exe",
            "hash": "fa19380e98ef487d5cac1fa0e8a0c24b8029496757171f2d798efcd2d3434728"
        }
    },
    "bin": "warmup-s3-archives.exe",
    "checkver": {
        "url": "https://gitlab.com/api/v4/projects/philipmw%2Fwarmup-s3-archives/releases/?per_page=1",
        "jsonpath": "$.[0].tag_name",
        "regex": "v([\\d.]+)"
    },
    "autoupdate": {
        "architecture": {
            "64bit": {
                "url": "https://gitlab.com/philipmw/warmup-s3-archives/-/releases/v$version/downloads/warmup-s3-archives-v$version-windows-x86_64.exe#/warmup-s3-archives.exe"
            }
        }
    }
}
