{
  "version": "0.2.0-beta1",
  "description": "A system tray app that shows GlazeWM current workspace, pause state, and more",
  "homepage": "https://github.com/babysnakes/GlazeWM-Tray",
  "architecture": {
    "64bit": {
      "url": "https://github.com/babysnakes/GlazeWM-Tray/releases/download/v0.2.0-beta1/GlazeWM-Tray_0.2.0-beta1_win-x64.zip",
      "hash": "775667078D087B61642E598D111096A383E712DDD8246B036D434C939EA57379"
    },
    "arm64": {
      "url": "https://github.com/babysnakes/GlazeWM-Tray/releases/download/v0.2.0-beta1/GlazeWM-Tray_0.2.0-beta1_win-arm64.zip",
      "hash": "616CEF99655EE8BB0C0C8C8B41FF26AB20F9EA2F4277A1F3DCDB29C00788B91B"
    }
  },
  "license":"MIT",
  "shortcuts": [
    [
        "GlazeWM-Tray.exe",
        "GlazeWM-Tray"
    ]
  ]
}
