{
    "version": "3.00",
    "homepage": "https://www.nirsoft.net/utils/wifi_information_view.html",
    "bin": "WifiInfoView.exe",
    "shortcuts": [
        [
            "WifiInfoView.exe",
            "NirSoft\\WifiInfoView"
        ]
    ],
    "pre_install": [
        "New-Item -Path $dir\\wifiinfoview.cfg | Out-Null",
        "New-Item -Path $dir\\wifiinfoview_lng.ini | Out-Null"
    ],
    "persist": [
        "wifiinfoview_lng.ini",
        "wifiinfoview.cfg"
    ],
    "architecture": {
        "64bit": {
            "url": "https://www.nirsoft.net/utils/wifiinfoview-x64.zip",
            "hash": "9264a6ef47b882fa67b9431f6410c62be091524c39877a09cf6744dea8d8a988"
        },
        "32bit": {
            "url": "https://www.nirsoft.net/utils/wifiinfoview.zip",
            "hash": "7281c7a7f90a796549e3cffa41a9beb0faf3feec549f914e5dd3c17cdbc7cfca"
        }
    },
    "description": "Displays extensive information about wireless networks in your area.",
    "license": "Freeware",
    "notes": "If this application is useful to you, please consider donating to NirSoft - https://www.nirsoft.net/donate.html",
    "checkver": {
        "url": "https://www.nirsoft.net/pad/wifiinfoview.xml",
        "xpath": "/XML_DIZ_INFO/Program_Info/Program_Version"
    },
    "autoupdate": {
        "architecture": {
            "64bit": {
                "url": "https://www.nirsoft.net/utils/wifiinfoview-x64.zip"
            },
            "32bit": {
                "url": "https://www.nirsoft.net/utils/wifiinfoview.zip"
            }
        }
    }
}
